{
  "version": 1,
  "record_sequence": 1,
  "previous_policy_sha256": "0000000000000000000000000000000000000000000000000000000000000000",
  "pow_bits": 24,
  "epoch_seconds": 600,
  "global_allocations_per_epoch": 5,
  "global_allocations_per_day": 200,
  "principal_lifetime_sats": 1000000000,
  "destination_lifetime_sats": 1000000000,
  "consensus_custody_ceiling_sats": 1000000000,
  "minimum_allocation_sats": 10000,
  "unfunded_expiry_seconds": 604800,
  "operator_descriptor_range": [0, 999],
  "public_descriptor_range": [1000, 10999],
  "journal_max_rows": 100000,
  "journal_max_bytes": 67108864,
  "lifecycle_reserve_percent": 10,
  "bitcoin_freshness_alert_seconds": 3600,
  "bitcoin_recovery_only_seconds": 7200,
  "peg_unlock_required": true,
  "archive_ack_required": true,
  "archive_authority_id": "REPLACE_WITH_SIGNED_C4_AUTHORITY_ID"
}
